{
  "$schema": "http://json-schema.org/draft-07/schema#",
  "title": "IES Intent",
  "type": "object",
  "additionalProperties": false,
  "required": [
    "id",
    "type",
    "parameters",
    "created_at"
  ],
  "properties": {
    "id": {
      "type": "string",
      "minLength": 1
    },
    "type": {
      "type": "string",
      "minLength": 1
    },
    "parameters": {
      "type": "object"
    },
    "created_at": {
      "type": "string",
      "format": "date-time"
    }
  }
}
