{
  "id": "intent_sc_001",
  "type": "STABLECOIN_TRANSFER",
  "parameters": {
    "chain_id": 11155111,
    "token_address": "0xTokenAddressExample000000000000000000000000",
    "from": "0xFromExample0000000000000000000000000000000000",
    "to": "0xToExample000000000000000000000000000000000000",
    "amount": "1000.00",
    "symbol": "USDC"
  },
  "created_at": "2026-02-23T00:00:00Z"
}
